#Nombre,  pais, maestria, doctorado, becas, descripcion, pagina
Universidad Nacional de Colombia, Colombia, 1, 1, 1, Obervatorio Astronomico Nacional de la Universidad Nacional de Colombia, http://ciencias.bogota.unal.edu.co/departamentos/observatorio-astronomico-nacional/el-observatorio/
Universidad de los Andes, Colombia, 0, 0, 1, Facultad de fisica con grupos de investigacion en astronomia, https://fisica.uniandes.edu.co/
Universidad de Antioquia, Colombia, 0, 0, 2, Facultad de fisica con grupos de investigacion en astronomia, http://astronomia-udea.co/principal/es
Universidad Industrial de Santander, Colombia, 1, 1, 2, Departamento de fisica con grupos de investigacion en astronomia, https://halley.uis.edu.co/
Universidad Pedagogica y tecnologica de colombia, Colombia, 1, 1, 2, Facultad de fisica con grupos de investigacion en astronomia, http://www.uptc.edu.co/facultades/f_ciencias/pregrado/fisica/inf_adicional/
Universidad autonoma de Mexico, Mexico, 1, 1, 1, Tiene varias sedes: Ciudad de Mexico Ensenada y Morelia, http://www.astroscu.unam.mx/IA/index.php?lang=es
Universidad de Guanajuato, Mexico, 1, 1, 1, , http://www.astro.ugto.mx/
Instituto Nacional de Astrofisica Optica y Electronica,  Mexico, 1, 1, 1, ,https://www.inaoep.mx/

